{
  "base_commit": null,
  "end_version": null,
  "instance_id": "godot-cardgame-poker-roguelike",
  "metadata": {
    "environment_profile": "godot",
    "mcp_profile": "godot",
    "validator_profile": "godot",
    "structural_review": {
      "method": "manual_static_workflow_review",
      "confidence": "high",
      "axes": {
        "subgoal_count": 5,
        "dependency_depth": 5,
        "state_representations": 4,
        "constraint_interaction": 5,
        "diagnosis_or_strategy_choice": 5,
        "independent_validation": 5,
        "coordination_potential": 5
      },
      "evidence": [
        "Pinned source-distinct task: cardgame-poker-roguelike.",
        "Public seed contains 2 files across 2 state formats: .md, .toml.",
        "Independent evaluator exposes 1 native command(s), 3 semantic assertion(s), and 0 numerical assertion(s).",
        "The reviewed shortest successful workflow requires audit, dependency planning, application execution, failure reconciliation, and independent verification."
      ]
    }
  },
  "problem_statement": "# Cardgame Poker Roguelike\n\nBuild a Cardgame Poker Roguelike in Godot 4 at `/workspace/game/`.\nThis is not a prototype. It is a **complete, shippable micro-game** that could\nsit on an itch.io page or Steam as a polished vertical slice.\n\n## Core Vision\n\nA roguelike scoring game built on poker hand evaluation. The player is dealt\ncards and must form poker hands (pairs, straights, flushes) to score points\nagainst escalating blind targets. The twist: collectible Joker cards modify\nscoring rules in wild ways — one might triple the value of all hearts, another\nmight make every pair count as a full house. Between rounds, a shop sells new\nJokers, card enhancements, and consumable items. The fantasy is discovering\nabsurd scoring combos that turn a humble pair of twos into a million-point\nhand. Fail to meet the blind and the run ends.\n\n## What the Player Experiences\n\n1. **Title Screen** — A casino-noir aesthetic with the game name in gold\n   embossed lettering on green felt, animated card shuffling in the background,\n   and New Run / Stats buttons. No plain Godot grey.\n2. **The Hand** — The player is dealt 8 cards from a standard deck. They select\n   up to 5 cards to form a poker hand and submit it for scoring. Remaining\n   cards can be discarded and redrawn (limited discards per round).\n3. **Scoring** — Each hand type has a base chip value and multiplier (e.g.,\n   Pair = 10 chips x2, Flush = 35 chips x4). Jokers and enhancements modify\n   these values. The score animates with each modifier applied sequentially,\n   building dramatic tension.\n4. **Blinds** — Each round has a target score (the blind). Small Blind, Big\n   Blind, and Boss Blind escalate. The player has multiple hands per round to\n   meet the target. Failing to reach the blind ends the run.\n5. **Joker Cards** — Up to 5 Joker slots. Each Joker has a unique rule-bending\n   effect with illustrated art and a description. Jokers are purchased from\n   the shop or earned from Boss Blinds. Synergies between Jokers create\n   exponential scoring potential.\n6. **Shop** — Between rounds, spend earned money on new Jokers, card\n   enhancements (foil, holographic, polychrome — each with scoring bonuses),\n   vouchers (permanent upgrades), or booster packs (new playing cards).\n7. **Boss Blinds** — Special blinds with debuff conditions (e.g., \"all clubs\n   are face-down\", \"no discards this round\", \"first hand played is\n   debuffed\"). The player must adapt their strategy to the boss condition.\n\n## Assets\n\n2D assets are mounted read-only at:\n\n- `/workspace/assets/library/` — Kenney CC0 packs (sprites, tiles, UI, fonts).\n- `/workspace/assets/library-oga/` — OpenGameArt entries; respect each\n  subdir's `LICENSE.txt`.\n\nBrowse the library and choose packs.\nCopy what you need into your project's `assets/` folder.\n\n## Project layout\n\n```\n/workspace/game/\n  project.godot\n  Main.tscn\n  demo_outputs/    ← your input traces (1–10 files)\n  scripts/  scenes/  assets/\n```\n\nThe build must launch cleanly with:\n\n```\ngodot --headless --path /workspace/game --quit-after 5\n```\n\nA reference for Godot CLI flags is at `/workspace/tools/godot_command_line.md`.\n**Engine flags like `--headless` and `--quit-after N` must come BEFORE `--`** —\nanything after `--` is forwarded to the project as user args and silently\nignored by the engine. Correct shape:\n`godot --headless --quit-after 5 --path . -- --scenario near_victory`.\n\nA screenshot helper is available at `/workspace/tools/screenshot.sh`. Use it to actually see what your UI / battlefield /\nresult screens look like.\n\n```\n/workspace/tools/screenshot.sh --path /workspace/game \\\n      -- --out /workspace/frame.png --frames 60\n```\n\nTo screenshot a specific scenario, append `--scenario <id>` after `--`. The\nhelper consumes only `--out` / `--frames` / `--scene`; remaining args stay in\n`OS.get_cmdline_user_args()` for your game code to read. Example:\n\n```\n/workspace/tools/screenshot.sh --path /workspace/game \\\n      -- --out /workspace/battle_debug.png --frames 120 --scenario battle\n```\n\n## Demos\n\nShip **1–10 input-trace files** under `/workspace/game/demo_outputs/`, one per\ndemo, each named `*.json`. The evaluator launches a fresh game per trace,\nreplays your trace as synthetic mouse and keyboard input at 1280×720, and\nrecords the screen. Only the first 10 traces by filename are evaluated;\nrecordings longer than 20 s are sampled from a random 20 s window.\n\n### Scenarios\n\nNormal play should start from the title screen and demonstrate the task's\ncore gameplay loop.\nDemo playback must be deterministic. For demos that need a specific state\n(a specific level, combat state, upgrade screen, result state, or late-game\nsetup), define named scenarios your game loads when launched with:\n\n```\ngodot --path /workspace/game -- --scenario <id>\n```\n\nWhen `--scenario <id>` is present the game must skip menus, set up the named\nstate deterministically (seed any RNG), and begin accepting input immediately.\n\n### Trace file format\n\n```json\n{\n  \"scenario\": \"title_flow\",\n  \"duration_frames\": 360,\n  \"events\": [\n    {\"frame\": 30,  \"type\": \"mouse_click\", \"button\": \"left\", \"x\": 300, \"y\": 360},\n    {\"frame\": 90,  \"type\": \"key_press\",   \"keycode\": \"1\"},\n    {\"frame\": 180, \"type\": \"key_press\",   \"keycode\": \"SPACE\"},\n    {\"frame\": 300, \"type\": \"wait\"}\n  ]\n}\n```\n\n- `scenario` — optional; omit for a normal game launch from the title screen.\n- `duration_frames` — total frames to record at 30 fps; cap at **600 (20 s)**.\n- `events` — time-ordered inputs. Coordinates are pixels in the 1280×720\n  viewport. Supported types:\n  - `mouse_click`: `{frame, type, button: \"left\"|\"right\", x, y}`\n  - `mouse_down` / `mouse_up`: `{frame, type, button: \"left\"|\"right\", x, y}` —\n    use these for drag interactions: emit `mouse_down` at the start point,\n    one or more `mouse_move` events along the way, and `mouse_up` at the end.\n    A `mouse_click` is a `mouse_down` + `mouse_up` at the same point in tight\n    succession.\n  - `mouse_move`: `{frame, type, x, y}`\n  - `key_press` / `key_down` / `key_up`: `{frame, type, keycode}` — keycodes:\n    `A`–`Z`, `0`–`9`, `ESCAPE`, `ENTER`, `SPACE`, `TAB`, `BACKSPACE`,\n    `DELETE`, `SHIFT`, `CTRL`, `ALT`, `UP`, `DOWN`, `LEFT`, `RIGHT`.\n  - `wait`: `{frame, type}` — anchor frame, no input.\n\nReplay must be deterministic: same trace, fresh launch, same outcome every time.\n\nThis is the pinned, source-distinct case `cardgame-poker-roguelike`. Inspect the project graph, resources, scripts, scenes, signals, and deterministic task-card states. Build the interacting mechanics as a runnable state machine, preserve transitions and content counts, diagnose headless failures, reconcile behavior with demonstrations, and verify launch, scripted replay, persistence, and output snapshots. First audit the supplied inputs and outputs; then plan dependency order before mutating state. After execution, inspect every intermediate and final artifact, repair failed invariants without discarding provenance, and finally run independent application-native and hidden semantic checks. Place only verified deliverables under output/.",
  "repo": null,
  "start_version": null,
  "target_software": "Godot",
  "task_kind": "software_use"
}
