{
  "base_commit": null,
  "end_version": null,
  "instance_id": "spreadsheetbench__105-13",
  "metadata": {
    "environment_profile": "spreadsheet",
    "instruction_type": "Sheet-Level Manipulation",
    "mcp_profile": "spreadsheet",
    "source_id": "105-13",
    "test_case_count": 3,
    "complexity_profile": {
      "schema_version": "1.0",
      "method": "mcp_profile_static_baseline",
      "confidence": "medium",
      "scale": "ordinal_1_to_5",
      "mcp_profile": "spreadsheet",
      "execution": {
        "minimum_workflow_steps": 5,
        "tool_chain_depth": 3,
        "relevant_tool_count": 4,
        "tool_category_count": 2,
        "state_entity_count": 4,
        "domain_concept_load": 3,
        "workflow_branching": 2,
        "verification_layers": 3,
        "irreversibility_risk": "medium"
      },
      "coordination": {
        "minimum_handoffs": 1,
        "cross_role_dependency_count": 1,
        "independent_verification_need": 2
      }
    },
    "structural_review": {
      "method": "manual_static_workflow_review",
      "confidence": "high",
      "axes": {
        "subgoal_count": 4,
        "dependency_depth": 4,
        "state_representations": 4,
        "constraint_interaction": 5,
        "diagnosis_or_strategy_choice": 4,
        "independent_validation": 5,
        "coordination_potential": 4
      },
      "evidence": [
        "Pinned source-distinct task: 105-13.",
        "Public seed contains 4 files across 2 state formats: .md, .xlsx.",
        "Independent evaluator exposes 1 native command(s), 0 semantic assertion(s), and 0 numerical assertion(s).",
        "The reviewed shortest successful workflow requires audit, dependency planning, application execution, failure reconciliation, and independent verification."
      ]
    }
  },
  "problem_statement": "How can I use VBA to filter data from a multi-column range on a 'Source' worksheet based on criteria in a specific cell or range of cells from a 'Calculation' worksheet, and then output the filtered results into specified corresponding cells or ranges on the 'Calculation' worksheet, for up to 16 columns, without the performance issues associated with volatile functions?\n\nThis is the pinned, source-distinct case `105-13`. Audit workbook structure, formulas, named ranges, formats, hidden sheets, and all public variants. Design a reusable transformation, reconcile repeated keys and missing data, preserve undeclared formulas and formatting, recalculate in the target application, diagnose discrepancies, and verify calculated values, formulas, and hidden regions. First audit the supplied inputs and outputs; then plan dependency order before mutating state. After execution, inspect every intermediate and final artifact, repair failed invariants without discarding provenance, and finally run independent application-native and hidden semantic checks. Place only verified deliverables under output/.",
  "repo": null,
  "start_version": null,
  "target_software": "Python, openpyxl, and LibreOffice Calc",
  "task_kind": "software_use"
}
